{
  "sample_id": "gold_train_001",
  "article_id": "art_train_01",
  "source_domain": "antaranews.com",
  "published_at": "2026-10-10T09:15:00Z",
  "category": "disaster_and_weather",
  "labels": {
    "event_id": "evt_jakarta_flood_2026_10",
    "timeline_order": 2,
    "location_canonical": "Jakarta Timur, DKI Jakarta",
    "has_conflict": false,
    "expected_change": false,
    "action_policy": "NO_IMMEDIATE_ACTION",
    "action_policy_violation": false
  },
  "claims": [
    {
      "claim_id": "clm_train_001",
      "verbatim_quote": "Ketinggian air di Kampung Melayu mencapai 70 sentimeter pada Sabtu pagi.",
      "speaker": null,
      "statement": "Ketinggian air banjir mencapai 70 cm di Kampung Melayu",
      "stance": "support",
      "canonical_event_id": "evt_jakarta_flood_2026_10"
    }
  ]
}