{
  "sample_id": "gold_train_011",
  "article_id": "art_train_11",
  "source_domain": "antaranews.com",
  "published_at": "2026-10-11T11:00:00Z",
  "category": "government_and_public_policy",
  "labels": {
    "event_id": "evt_idn_trans_subsidy_2026_10",
    "timeline_order": 2,
    "location_canonical": "Jakarta Pusat, DKI Jakarta",
    "has_conflict": false,
    "expected_change": false,
    "action_policy": "NO_IMMEDIATE_ACTION",
    "action_policy_violation": false
  },
  "claims": [
    {
      "claim_id": "clm_train_011",
      "verbatim_quote": "Pengamat transportasi menyambut positif Perpres 88/2026 yang diyakini menekan ongkos harian komuter.",
      "speaker": null,
      "statement": "Perpres 88/2026 dinilai meringankan biaya komuter",
      "stance": "support",
      "canonical_event_id": "evt_idn_trans_subsidy_2026_10"
    }
  ]
}