{
  "sample_id": "gold_dev_006",
  "article_id": "art_dev_06",
  "source_domain": "antaranews.com",
  "published_at": "2026-10-07T14:00:00Z",
  "category": "disaster_and_weather",
  "labels": {
    "event_id": "evt_jkb_rob_2026_10",
    "timeline_order": 1,
    "location_canonical": "Jakarta Barat, DKI Jakarta",
    "has_conflict": false,
    "expected_change": true,
    "action_policy": "INFORMATIONAL",
    "action_policy_violation": false
  },
  "claims": [
    {
      "claim_id": "clm_dev_006",
      "verbatim_quote": "Pasang rob air laut menyebabkan genangan di kawasan permukiman pesisir Jakarta Barat pada Rabu siang sekitar pukul 13:00 WIB.",
      "speaker": null,
      "statement": "Banjir rob merendam pesisir Jakarta Barat Rabu siang",
      "stance": "support",
      "canonical_event_id": "evt_jkb_rob_2026_10"
    }
  ]
}