{
  "sample_id": "gold_dev_001",
  "article_id": "art_dev_01",
  "source_domain": "bpbd.jakarta.go.id",
  "published_at": "2026-10-10T08:30:00Z",
  "category": "disaster_and_weather",
  "labels": {
    "event_id": "evt_jakarta_flood_2026_10",
    "timeline_order": 1,
    "location_canonical": "Jakarta Timur, DKI Jakarta",
    "has_conflict": false,
    "expected_change": true,
    "action_policy": "ACTION_REQUIRED",
    "action_policy_violation": false
  },
  "claims": [
    {
      "claim_id": "clm_dev_001",
      "verbatim_quote": "BPBD DKI Jakarta menetapkan status Siaga 2 untuk wilayah bantaran Ciliwung menyusul kenaikan debit air di Pos Pantau Depok.",
      "speaker": "Pusdatin BPBD",
      "statement": "Status Siaga 2 diberlakukan untuk kawasan bantaran Ciliwung",
      "stance": "support",
      "canonical_event_id": "evt_jakarta_flood_2026_10"
    }
  ]
}